{"accepted":true,"canonical_input_sha256":"eeca45c5b395a396abb3f70c9158a435fbc4febb65f0052cacac04b15c11126c","capture":{"adapter_warnings":[],"completeness":"complete"},"checks":[{"id":"input-contract","state":"passed"},{"id":"evidence-classification","state":"passed"},{"id":"external-execution","state":"not-run"},{"id":"identity-authentication","state":"not-run"},{"id":"permission-validation","state":"not-run"},{"id":"intent-assessment","state":"not-run"}],"claim":{"id":"claim-bep-summary-supported","text":"Bazel invocation 11111111-2222-3333-4444-555555555555 recorded the requested artifact summary-output for target //reports:summary with configured digest aaaaaaaaaaaaaaaaaaaaaaaaaaaaaaaaaaaaaaaaaaaaaaaaaaaaaaaaaaaaaaaa and length 184 bytes, and the build completed successfully.","type":"artifact-created"},"does_not_establish":["correctness","safety","identity","successful-execution","authority","permission"],"downstream_action_authorized":false,"evidence_results":[{"id":"bep-invocation-identity","observed_channel":"bazel-build-event-protocol-json-file","observed_value":"uuid=11111111-2222-3333-4444-555555555555; build_tool_version=8.7.0; command=build","requirement":"The capture identifies the claimed Bazel invocation and build command.","source_ref":"bep-capture#events:0","source_revision":"Bazel BEP JSON 8.7.0","source_sha256":"6e7ff7dd3108d4d922fbdc621ce836331f69d468782b2c6f9dd3814b1fcd7406","state":"supports"},{"id":"bep-target-result","observed_channel":"bazel-build-event-protocol-json-file","observed_value":"target_label=//reports:summary; configuration_sha256=256821caba4e7db48ee6c68385a66324bfb2af50aa23fea1bef690ddbbd4b7d4; aspect=base; success=true; output_group=default; incomplete=false; aspect_isolated_count=0","requirement":"The exact base target/configuration completed successfully and its selected output group was not marked incomplete.","source_ref":"bep-capture#events:1","source_revision":"Bazel BEP JSON 8.7.0","source_sha256":"6e7ff7dd3108d4d922fbdc621ce836331f69d468782b2c6f9dd3814b1fcd7406","state":"supports"},{"id":"bep-artifact-record","observed_channel":"bazel-build-event-protocol-json-file","observed_value":"artifact_label=summary-output; path_sha256=0caa130c31943bcadfab81a94bc4a672604d45bff11949e835e7098a1c6041b8; configured_digest=aaaaaaaaaaaaaaaaaaaaaaaaaaaaaaaaaaaaaaaaaaaaaaaaaaaaaaaaaaaaaaaa; length=184; form=uri","requirement":"The selected output group's transitive named-file set contains exactly one file matching the requested path, configured digest, byte length, and ordinary file-reference form.","source_ref":"bep-capture#events:2","source_revision":"Bazel BEP JSON 8.7.0","source_sha256":"6e7ff7dd3108d4d922fbdc621ce836331f69d468782b2c6f9dd3814b1fcd7406","state":"supports"},{"id":"bep-build-terminal","observed_channel":"bazel-build-event-protocol-json-file","observed_value":"exit_code=0; exit_name=SUCCESS; finish_time=2026-08-31T12:34:56.123456789Z","requirement":"The same invocation has an authoritative successful BuildFinished event with a finish time.","source_ref":"bep-capture#events:3","source_revision":"Bazel BEP JSON 8.7.0","source_sha256":"6e7ff7dd3108d4d922fbdc621ce836331f69d468782b2c6f9dd3814b1fcd7406","state":"supports"},{"id":"bep-stream-completeness","observed_channel":"bazel-build-event-protocol-json-file","observed_value":"posted_count=4; announced_count=3; missing_count=0; root_reachable_count=4; final_marker=true; source_byte_length=930","requirement":"The supplied source contains one valid, root-reachable, closed BEP event DAG and a final completion assertion.","source_ref":"bep-capture#events:0,1,2,3","source_revision":"Bazel BEP JSON 8.7.0","source_sha256":"6e7ff7dd3108d4d922fbdc621ce836331f69d468782b2c6f9dd3814b1fcd7406","state":"supports"}],"evidence_state_counts":{"absent":0,"contradictory":0,"inapplicable":0,"stale":0,"supports":5,"unknown":0},"finding":"supported","intent_assessment":"not-assessed","raw_input_sha256":"eeca45c5b395a396abb3f70c9158a435fbc4febb65f0052cacac04b15c11126c","schema_version":"daid_agent_claim_check_receipt_v1"}
